[
  {
    "decisionId": "decision-5e08a12c-07a1-4f9f-89a0-1cc93bb2b01b",
    "schemaVersion": "1.0",
    "runId": "run-cf135071-be15-423c-b7f0-b0c37713f419",
    "stepId": "classification",
    "parentDecisionIds": [],
    "agentInstanceId": "run-cf135071-be15-423c-b7f0-b0c37713f419-classifier",
    "role": "classifier",
    "roleContextId": "run-cf135071-be15-423c-b7f0-b0c37713f419-classifier",
    "bindingSnapshotId": "snapshot-e8bec795e604c7bf7cedd672452591393be3f2612d385d917f75c679400300f8",
    "decisionType": "CLASSIFY_TASK",
    "objectiveRef": "objective-run-cf135071-be15-423c-b7f0-b0c37713f419",
    "constraintSnapshotId": "snapshot-2c627060948974a7ff39bca65c304fcb6c88bd4106d2450270aa5f00804637be",
    "featureSnapshotId": "snapshot-ae5e558dedb8b8463001059f8d09c179d09c79e3c77b12b74910e5acf98c8713",
    "evidenceRefs": [],
    "assumptions": [],
    "options": [
      {
        "optionId": "classify-inspect",
        "actionKind": "CLASSIFY",
        "summary": "OPTION_SUMMARY_REDACTED",
        "requiredCapabilityIds": [],
        "evidenceRefs": [],
        "riskCodes": [],
        "rejectionReasonCodes": [
          "RULE_PATTERN_MISMATCH"
        ]
      },
      {
        "optionId": "classify-modify",
        "actionKind": "CLASSIFY",
        "summary": "OPTION_SUMMARY_REDACTED",
        "requiredCapabilityIds": [],
        "evidenceRefs": [],
        "riskCodes": [],
        "rejectionReasonCodes": [
          "RULE_PATTERN_MISMATCH"
        ]
      },
      {
        "optionId": "classify-test",
        "actionKind": "CLASSIFY",
        "summary": "OPTION_SUMMARY_REDACTED",
        "requiredCapabilityIds": [],
        "evidenceRefs": [],
        "riskCodes": [],
        "rejectionReasonCodes": []
      },
      {
        "optionId": "classify-unknown",
        "actionKind": "CLASSIFY",
        "summary": "OPTION_SUMMARY_REDACTED",
        "requiredCapabilityIds": [],
        "evidenceRefs": [],
        "riskCodes": [],
        "rejectionReasonCodes": [
          "RULE_PATTERN_MISMATCH"
        ]
      }
    ],
    "decisionSummary": "DECISION_SUMMARY_REDACTED",
    "selectionCriteria": [
      "task-classification-rule"
    ],
    "reasonCodes": [
      "DETERMINISTIC_RULE",
      "NO_EVIDENCE_REQUIRED"
    ],
    "uncertaintyCodes": [],
    "expectedOutcome": {
      "successCriteriaRefs": [
        "criterion-classification"
      ],
      "predictedOutcomeCode": "PIPELINE_STEP_ACCEPTED",
      "predictedRiskCodes": [],
      "predictedProgress": 0.1
    },
    "outputRefs": [
      "classification-run-cf135071-be15-423c-b7f0-b0c37713f419"
    ],
    "sensitivity": "INTERNAL",
    "createdAtMs": 1791400878540,
    "status": "COMMITTED",
    "selectedOptionId": "classify-test",
    "recordDigest": "sha256:9ff1b6214a69ac4bf73f6a9966ec91e2202d04f9f9e9aa08907f284735ce88c7",
    "updatedAtMs": 1791400878660,
    "committedAtMs": 1791400878660
  },
  {
    "decisionId": "decision-146a7675-f517-4812-b6f7-050e734311de",
    "schemaVersion": "1.0",
    "runId": "run-cf135071-be15-423c-b7f0-b0c37713f419",
    "stepId": "routing",
    "parentDecisionIds": [
      "decision-5e08a12c-07a1-4f9f-89a0-1cc93bb2b01b"
    ],
    "agentInstanceId": "run-cf135071-be15-423c-b7f0-b0c37713f419-router",
    "role": "router",
    "roleContextId": "run-cf135071-be15-423c-b7f0-b0c37713f419-router",
    "bindingSnapshotId": "snapshot-e8bec795e604c7bf7cedd672452591393be3f2612d385d917f75c679400300f8",
    "decisionType": "SELECT_ROUTE",
    "objectiveRef": "objective-run-cf135071-be15-423c-b7f0-b0c37713f419",
    "constraintSnapshotId": "snapshot-faf7b8a4266f162e43bff0d0682906f6affacc60cc889e7cb6664183d9b329e1",
    "featureSnapshotId": "snapshot-975274421a69d6c99a57c8cbbc05564ed0ee81fc1b7796d35d2aed8dd2e5a4fb",
    "evidenceRefs": [],
    "assumptions": [],
    "options": [
      {
        "optionId": "route-selected",
        "actionKind": "ROUTE",
        "summary": "OPTION_SUMMARY_REDACTED",
        "requiredCapabilityIds": [],
        "evidenceRefs": [],
        "riskCodes": [],
        "rejectionReasonCodes": []
      },
      {
        "optionId": "route-blocked",
        "actionKind": "BLOCK_ROUTE",
        "summary": "OPTION_SUMMARY_REDACTED",
        "requiredCapabilityIds": [],
        "evidenceRefs": [],
        "riskCodes": [
          "POLICY_REJECTED"
        ],
        "rejectionReasonCodes": [
          "POLICY_ALLOWED"
        ]
      }
    ],
    "decisionSummary": "DECISION_SUMMARY_REDACTED",
    "selectionCriteria": [
      "read-only-route-rule"
    ],
    "reasonCodes": [
      "DETERMINISTIC_RULE",
      "NO_EVIDENCE_REQUIRED"
    ],
    "uncertaintyCodes": [],
    "expectedOutcome": {
      "successCriteriaRefs": [
        "criterion-routing"
      ],
      "predictedOutcomeCode": "PIPELINE_STEP_ACCEPTED",
      "predictedRiskCodes": [],
      "predictedProgress": 0.1
    },
    "outputRefs": [
      "route-run-cf135071-be15-423c-b7f0-b0c37713f419"
    ],
    "sensitivity": "INTERNAL",
    "createdAtMs": 1791400879194,
    "status": "COMMITTED",
    "selectedOptionId": "route-selected",
    "recordDigest": "sha256:cf2157f2e74cd503e7890864c2608a023ff845d51fcecadfc62fb19199361951",
    "updatedAtMs": 1791400879287,
    "committedAtMs": 1791400879287
  },
  {
    "decisionId": "decision-2a0eec08-7022-45e8-afda-c2ca1be7c18a",
    "schemaVersion": "1.0",
    "runId": "run-cf135071-be15-423c-b7f0-b0c37713f419",
    "stepId": "context-allocation",
    "parentDecisionIds": [
      "decision-146a7675-f517-4812-b6f7-050e734311de"
    ],
    "agentInstanceId": "run-cf135071-be15-423c-b7f0-b0c37713f419-coordinator",
    "role": "coordinator",
    "roleContextId": "run-cf135071-be15-423c-b7f0-b0c37713f419-coordinator",
    "bindingSnapshotId": "snapshot-0d2ad29a0b4f11d5b05b10a6634a73801810f0bd935d080b470d9c3801cfcc96",
    "decisionType": "ALLOCATE_ROLE_CONTEXTS",
    "objectiveRef": "objective-run-cf135071-be15-423c-b7f0-b0c37713f419",
    "constraintSnapshotId": "snapshot-faf7b8a4266f162e43bff0d0682906f6affacc60cc889e7cb6664183d9b329e1",
    "featureSnapshotId": "snapshot-8dde63f7422588d5593aa119518e1660fd67e6638e241b66833905fb882e168e",
    "evidenceRefs": [],
    "assumptions": [],
    "options": [
      {
        "optionId": "contexts-dedicated",
        "actionKind": "ALLOCATE_CONTEXTS",
        "summary": "OPTION_SUMMARY_REDACTED",
        "requiredCapabilityIds": [],
        "evidenceRefs": [],
        "riskCodes": [],
        "rejectionReasonCodes": []
      },
      {
        "optionId": "contexts-shared",
        "actionKind": "ALLOCATE_CONTEXTS",
        "summary": "OPTION_SUMMARY_REDACTED",
        "requiredCapabilityIds": [],
        "evidenceRefs": [],
        "riskCodes": [
          "CONTEXT_CROSSTALK"
        ],
        "rejectionReasonCodes": [
          "ROLE_ISOLATION_REQUIRED"
        ]
      }
    ],
    "decisionSummary": "DECISION_SUMMARY_REDACTED",
    "selectionCriteria": [
      "role-isolation-rule"
    ],
    "reasonCodes": [
      "DETERMINISTIC_RULE",
      "NO_EVIDENCE_REQUIRED"
    ],
    "uncertaintyCodes": [],
    "expectedOutcome": {
      "successCriteriaRefs": [
        "criterion-context-allocation"
      ],
      "predictedOutcomeCode": "PIPELINE_STEP_ACCEPTED",
      "predictedRiskCodes": [],
      "predictedProgress": 0.1
    },
    "outputRefs": [
      "contexts-run-cf135071-be15-423c-b7f0-b0c37713f419"
    ],
    "sensitivity": "INTERNAL",
    "createdAtMs": 1791400880198,
    "status": "COMMITTED",
    "selectedOptionId": "contexts-dedicated",
    "recordDigest": "sha256:7cf1c5fedfe3929bd12f5f5a7922f8d12a8e96e8462157127f1d09586afb0985",
    "updatedAtMs": 1791400880299,
    "committedAtMs": 1791400880299
  },
  {
    "decisionId": "decision-e87ff369-b8ad-4721-b9af-0e0ccee838db",
    "schemaVersion": "1.0",
    "runId": "run-cf135071-be15-423c-b7f0-b0c37713f419",
    "stepId": "planning",
    "parentDecisionIds": [
      "decision-2a0eec08-7022-45e8-afda-c2ca1be7c18a"
    ],
    "agentInstanceId": "run-cf135071-be15-423c-b7f0-b0c37713f419-planner",
    "role": "planner",
    "roleContextId": "run-cf135071-be15-423c-b7f0-b0c37713f419-planner",
    "bindingSnapshotId": "snapshot-a72590141294f1e9b3352f14365bccc5e0f4f1ab0be00c08cf4ea6708383c131",
    "decisionType": "CREATE_PLAN",
    "objectiveRef": "objective-run-cf135071-be15-423c-b7f0-b0c37713f419",
    "constraintSnapshotId": "snapshot-faf7b8a4266f162e43bff0d0682906f6affacc60cc889e7cb6664183d9b329e1",
    "featureSnapshotId": "snapshot-da1c847a8d694fe2711f458c40c0eb74ccf9670a197121d51975393a4596314c",
    "evidenceRefs": [
      {
        "evidenceId": "evidence-TaskRunCreated-event-54480594-17bd-4f68-be4b-c671a3a2d237",
        "evidenceType": "TaskRunCreated",
        "stance": "SUPPORTS",
        "freshnessAtMs": 1791400881202,
        "eventId": "event-54480594-17bd-4f68-be4b-c671a3a2d237",
        "artifactDigest": "sha256:921c332e90ea5a0089d1584c62a47697c8d5c5938018f80d1c3be557bce75a45"
      },
      {
        "evidenceId": "evidence-TaskClassified-run-event-4e5b92d5-7b4f-4c56-8233-0d65e9d30022",
        "evidenceType": "TaskClassified",
        "stance": "SUPPORTS",
        "freshnessAtMs": 1791400881202,
        "eventId": "run-event-4e5b92d5-7b4f-4c56-8233-0d65e9d30022",
        "artifactDigest": "sha256:67e44796105b10d32b9e9d812054231c7fa5dd9403bf25bf9718bba4aa5f39b4"
      },
      {
        "evidenceId": "evidence-RoleBindingsResolved-run-event-b89eca4d-715d-4aea-a5ed-87ec61975cd2",
        "evidenceType": "RoleBindingsResolved",
        "stance": "SUPPORTS",
        "freshnessAtMs": 1791400881202,
        "eventId": "run-event-b89eca4d-715d-4aea-a5ed-87ec61975cd2",
        "artifactDigest": "sha256:7786b84d7ec45dc18f333baffc7f4a18d3f5884a87caca8f41b0fa136da5abae"
      }
    ],
    "assumptions": [],
    "options": [
      {
        "optionId": "plan-bounded-default",
        "actionKind": "PLAN",
        "summary": "OPTION_SUMMARY_REDACTED",
        "requiredCapabilityIds": [],